{
  "$schema": "http://json-schema.org/draft-07/schema#",
  "$id": "https://mirage-sitl.invalid/schemas/aircraft-profile.schema.json",
  "title": "MirageSITL aircraft profile v1",
  "description": "Multirotor aircraft profile (TASK-138). SI units; positions are body FRD metres from the body reference point. Code checks what the schema cannot express: ascending unique arm and motor IDs, known arms, one single motor or one upper and one lower motor per arm, a pair separation exactly for pairs, unique outputs, distinct arm mounts, and realizable inertia tensors.",
  "definitions": {
    "cardReference": {
      "description": "SHA-256 address of a component-card version in the project store (TASK-136, TASK-139), or null while none is selected.",
      "type": ["string", "null"],
      "pattern": "^[a-f0-9]{64}$"
    },
    "vector3": {
      "type": "array",
      "minItems": 3,
      "maxItems": 3,
      "items": { "type": "number" }
    },
    "matrix3": {
      "description": "Row-major 3x3 tensor in body FRD axes.",
      "type": "array",
      "minItems": 9,
      "maxItems": 9,
      "items": { "type": "number" }
    }
  },
  "type": "object",
  "additionalProperties": false,
  "required": [
    "schemaVersion",
    "units",
    "bodyFrame",
    "arms",
    "motors",
    "massProperties",
    "payload",
    "battery",
    "groundClearanceM",
    "sensorConfiguration"
  ],
  "properties": {
    "schemaVersion": { "const": 1 },
    "units": { "const": "SI" },
    "bodyFrame": { "const": "FRD" },
    "arms": {
      "type": "array",
      "minItems": 1,
      "maxItems": 8,
      "items": {
        "type": "object",
        "additionalProperties": false,
        "required": ["id", "lengthM", "azimuthRad", "heightM", "outwardTiltRad", "sideTiltRad", "pairSeparationM"],
        "properties": {
          "id": { "type": "integer", "minimum": 1, "maximum": 8 },
          "lengthM": {
            "description": "Horizontal distance from the body z axis through the reference point to the motor axis at the arm's mount.",
            "type": "number",
            "exclusiveMinimum": 0
          },
          "azimuthRad": {
            "description": "Angle in the body x-y plane from forward towards right, clockwise seen from above.",
            "type": "number",
            "exclusiveMinimum": -3.141592653589793,
            "maximum": 3.141592653589793
          },
          "heightM": {
            "description": "Height of the mount above the reference point; body FRD z is -heightM.",
            "type": "number"
          },
          "outwardTiltRad": {
            "description": "Lean of the thrust axis away from the body z axis, measured in the arm's vertical plane.",
            "type": "number",
            "exclusiveMinimum": -1.5707963267948966,
            "exclusiveMaximum": 1.5707963267948966
          },
          "sideTiltRad": {
            "description": "Lean of the thrust axis towards increasing azimuth, measured in the vertical plane across the arm.",
            "type": "number",
            "exclusiveMinimum": -1.5707963267948966,
            "exclusiveMaximum": 1.5707963267948966
          },
          "pairSeparationM": {
            "description": "Distance between the two rotor hubs of a coaxial pair along the thrust axis; null for a single motor.",
            "type": ["number", "null"],
            "exclusiveMinimum": 0
          }
        }
      }
    },
    "motors": {
      "type": "array",
      "minItems": 1,
      "maxItems": 16,
      "items": {
        "type": "object",
        "additionalProperties": false,
        "required": ["id", "armId", "level", "spin", "output", "components"],
        "properties": {
          "id": { "type": "integer", "minimum": 1, "maximum": 16 },
          "armId": { "type": "integer", "minimum": 1, "maximum": 8 },
          "level": {
            "description": "single: the only motor of its arm; upper: the pair motor on the thrust side; lower: the other pair motor.",
            "enum": ["single", "upper", "lower"]
          },
          "spin": {
            "description": "Rotation seen from the thrust side, which is from above for an untilted rotor.",
            "enum": ["ccw", "cw"]
          },
          "output": {
            "description": "ArduPilot servo output number (SERVOn); the actuator channel is output - 1.",
            "type": "integer",
            "minimum": 1,
            "maximum": 16
          },
          "components": {
            "type": "object",
            "additionalProperties": false,
            "required": ["motor", "propeller", "esc"],
            "properties": {
              "motor": { "$ref": "#/definitions/cardReference" },
              "propeller": { "$ref": "#/definitions/cardReference" },
              "esc": { "$ref": "#/definitions/cardReference" }
            }
          }
        }
      }
    },
    "massProperties": {
      "description": "The aircraft as flown without payload: airframe, propulsion and battery.",
      "type": "object",
      "additionalProperties": false,
      "required": ["massKg", "cgOffsetBodyM", "inertiaCgKgM2"],
      "properties": {
        "massKg": { "type": "number", "exclusiveMinimum": 0 },
        "cgOffsetBodyM": { "$ref": "#/definitions/vector3" },
        "inertiaCgKgM2": { "$ref": "#/definitions/matrix3" }
      }
    },
    "payload": {
      "description": "A rigid payload with its own CG and inertia about that CG (zero for a point mass), or null.",
      "type": ["object", "null"],
      "additionalProperties": false,
      "required": ["massKg", "cgOffsetBodyM", "inertiaCgKgM2"],
      "properties": {
        "massKg": { "type": "number", "exclusiveMinimum": 0 },
        "cgOffsetBodyM": { "$ref": "#/definitions/vector3" },
        "inertiaCgKgM2": { "$ref": "#/definitions/matrix3" }
      }
    },
    "battery": {
      "type": "object",
      "additionalProperties": false,
      "required": ["card"],
      "properties": {
        "card": { "$ref": "#/definitions/cardReference" }
      }
    },
    "groundClearanceM": {
      "description": "Height of the reference point above level ground when the aircraft rests on its supports (decision F-07), or null.",
      "type": ["number", "null"],
      "exclusiveMinimum": 0
    },
    "sensorConfiguration": {
      "description": "Reserved for TASK-143; schema 1 holds no sensor configuration.",
      "type": "null"
    }
  }
}
